{"campaign_admitted":true,"evaluation_observation_count":0,"expected_observation_count":43200,"fixture_bundle_sha256":"7e861cb17b5f4717d732989d1ddaaeb4ab3e3e4e0ae1d92dd19de35afa397fed","fixture_file_sha256":"56b04e0bcc35c26eea2848a0244827d7285e5056667f17deae628c0986921cbd","hardware_writes":0,"limitations":["Synthetic Isaac admission does not establish physical or deployment qualification","Only a complete receipt may be consumed by later training","Evaluation remains absent"],"manifest_count":19,"manifests":[{"dataset_sha256":"92fac974f3b5bb879017d0b210e9b7bd6cddff4de5baec21ac363e9acb933261","manifest_file_sha256":"31974808bd0fa7162d018f4862998755d3e7104accac83c6d75d68a95f867588","observation_count":2304,"target_count":4,"target_start":0},{"dataset_sha256":"ccba9cc230fbd5a67fe60db5d453d14e6dee79e5485d856fb56aadb834c69863","manifest_file_sha256":"8c463d0446060f2ef34d730e3a07412c13dd130880c131a6a14c4ec92b474aab","observation_count":2304,"target_count":4,"target_start":4},{"dataset_sha256":"4f686ef58f81e7796a7a2e810594dcf919042bd5e42ed617ec6e4308ee67ddaf","manifest_file_sha256":"db503fe7410c7e24ed24da8b0929a1991e27c00b8911c598eb23c9e486d19ee0","observation_count":2304,"target_count":4,"target_start":8},{"dataset_sha256":"a33b16de3de5cd59b4aad6841a958f9715d91dec093e2449c77db2dae22aca98","manifest_file_sha256":"211d9abb2696b0b1b6444bc904f2f35af30d90cea4d0c34339e8d426ca46072a","observation_count":2304,"target_count":4,"target_start":12},{"dataset_sha256":"a72de2265a7a7d8896ef1050c7cfd1eb8eabd30ceef3445c8ed896cd7afef050","manifest_file_sha256":"6ee9ba6576a48c53c82c2052489b577e1324f21aa6e6b5116deb02d623d270b7","observation_count":2304,"target_count":4,"target_start":16},{"dataset_sha256":"76d61129e8d319d13152a5b969227199d6800f2c7335a1befb21de7492458e04","manifest_file_sha256":"4f1c2e264d0adbbbe91367cc4f4b65fe9514f8e25ee1f422c25eceb26e598b6d","observation_count":2304,"target_count":4,"target_start":20},{"dataset_sha256":"76b195ff669f4f2b30795e801b74818322e195334d4a6f868e691635f3125aa0","manifest_file_sha256":"cd0cf4d1d4f2b99d37d20504ef2eba933583e6f09de0f442eba5ad3ce7f6a654","observation_count":2304,"target_count":4,"target_start":24},{"dataset_sha256":"634aa1b5b9ff02742283791ea7407031ca19acdefbd38f96fd3166c263957290","manifest_file_sha256":"eb14a2205da8b818fd7374ba625515c6d1686dd4ad0993de49266629fb8544a7","observation_count":2304,"target_count":4,"target_start":28},{"dataset_sha256":"a42ae6e96d74198bdae260c7a7c009267e35d8e9748c3a87e5d2263e2d9bfa80","manifest_file_sha256":"cfdc18875521896a97714d61a6e250a7fe33d231e967cd4d1433533fef0b58c4","observation_count":2304,"target_count":4,"target_start":32},{"dataset_sha256":"ccd1d827d869df5398c6dab727c2f4fc0a7ba81930972e1a551fc22b54a1979b","manifest_file_sha256":"eb695b9aa6b12db84c6eb562c2eeda35ee19aab04231252e1bf8329255d91652","observation_count":2304,"target_count":4,"target_start":36},{"dataset_sha256":"ae82dcd292fa2784a9fc9e8b2945e7added517d11eb4dd57bba48db0f5188ad6","manifest_file_sha256":"ca9c826c15444f95fded59c10ef68ddf8cd6ce8eff334f453afed72a9a69ebc2","observation_count":2304,"target_count":4,"target_start":40},{"dataset_sha256":"ba4f4151fc06f3e49a85472951bb251ae1ff057aa6c986f8c9ab89daad8384b8","manifest_file_sha256":"b8c628a9e1ddbaa62297467b67152a7deab504a38ba7541a868c759b84e5b08e","observation_count":2304,"target_count":4,"target_start":44},{"dataset_sha256":"15f672773309d2e971344f66486503d52c2f66ce3fe2f573d8330da846c090a9","manifest_file_sha256":"f0efcb8ae7ce368c2797ff5d011cb3ea781b20afd1c7c7ab4859563ab229339f","observation_count":2304,"target_count":4,"target_start":48},{"dataset_sha256":"7d721505f09f6d6a430a09dd3e5e250f95ad4982a0ff80bc5af9415d7fd5414a","manifest_file_sha256":"2e1ab3aed803f03dada69986918b6333ea91357a980a0fca47290f3c636b14b4","observation_count":2304,"target_count":4,"target_start":52},{"dataset_sha256":"16e029620d7422d9d0f4070e76412d1af5c0c6bf3c00c87037d39a9dc4f04328","manifest_file_sha256":"e13f8fa7470a9cf95625e2198fe75c4d5e673b81b9e8d4d8b9435a129e141afa","observation_count":2304,"target_count":4,"target_start":56},{"dataset_sha256":"d2522e7e3ae40311666debd77ed4c77175ecfc0fbb98a634636199e1d4358ba0","manifest_file_sha256":"c362f60319c2fb22f10b00c13b7240af1d885452e036cd8c78fd334fa2282328","observation_count":2304,"target_count":4,"target_start":60},{"dataset_sha256":"52a66261f58439a57069bc0186bad0e630286011c2c6514caa87e30bacefcd95","manifest_file_sha256":"b1c8e4069daf48ad4118d5b67635448de62fde5b869dcad98dd4df54892d632b","observation_count":2304,"target_count":4,"target_start":64},{"dataset_sha256":"434498555630d8f55daec50e11db2833a1243ac049c27e15eec60511a7541844","manifest_file_sha256":"0b4a96d6bc1e1a58cc38d1f0bea03d9e173afdd60c2269ffb7feae64e67b8ef3","observation_count":2304,"target_count":4,"target_start":68},{"dataset_sha256":"5de9b4d4ebc67a8b27eb204a0b1427e92c4d5c0017e5e7782f86c844b42fb670","manifest_file_sha256":"51c66987beec56051709ef74dde6637dfcbe2553120d1b8e4173ec3c447b9910","observation_count":1728,"target_count":3,"target_start":72}],"missing_observation_count":0,"physical_authority":false,"physical_movements":0,"receipt_sha256":"8a3868f1daa98326186541c368a14bf28b86e4df85180e3198dfd4fa6b456efe","rgb_bytes":133155943,"schema":"tactevra.ai_residual_obstruction_v3_admission.v1","scope":"SYNTHETIC_ISAAC_ADMISSION_NO_QUALIFICATION","split_counts":{"development":14400,"training":28800},"status":"PASS","target_catalog_sha256":"6779213e832ab27eeda1e7fb245f57ff8cb0d56707b5aa73a8f31ec483a620f2","training_started":false,"unique_rgb_sha256_count":43200,"verified_observation_count":43200}
